{
  "$schema": "https://json-schema.org/draft/2020-12/schema",
  "type": "object",
  "additionalProperties": false,
  "required": ["adapter", "required_files", "config_schema", "default_config", "presets"],
  "properties": {
    "adapter": {
      "type": "object", "additionalProperties": false, "required": ["id", "version"],
      "properties": {
        "id": {"type": "string", "pattern": "^[a-z][a-z0-9-]{0,63}$"},
        "version": {"type": "string", "minLength": 1, "maxLength": 64}
      }
    },
    "required_files": {
      "type": "array", "minItems": 1, "uniqueItems": true,
      "items": {"type": "string", "minLength": 1}
    },
    "config_schema": {"type": "object"},
    "default_config": {"type": "object"},
    "presets": {
      "type": "object", "minProperties": 1,
      "propertyNames": {"pattern": "^[a-z][a-z0-9-]{0,63}$"},
      "additionalProperties": {
        "type": "object", "additionalProperties": false,
        "required": ["dataset", "description"],
        "properties": {
          "dataset": {
            "type": "object", "additionalProperties": false, "required": ["id"],
            "properties": {
              "id": {"type": "string", "pattern": "^[a-zA-Z0-9][a-zA-Z0-9_.-]{0,127}$"},
              "name": {"type": "string", "minLength": 1, "maxLength": 128},
              "description": {"type": "string", "maxLength": 4096}
            }
          },
          "description": {"type": "string", "minLength": 1},
          "config": {"type": "object"}
        }
      }
    }
  }
}
